{
  "schema_version": "tos_human_form_set_v1",
  "subject": {
    "id": "tos.edition.pali-canon.sn56.53.en-sujato-bilara.bilara-d6d54741b7f2",
    "version": 1,
    "digest": "sha256:c1822c832bb8da422b928dab026f034d934dd93a76646a267a861443219335da"
  },
  "forms": [
    {
      "bindings": {
        "context-0": {
          "pointer": "/identity_status",
          "record": {
            "digest": "sha256:c1822c832bb8da422b928dab026f034d934dd93a76646a267a861443219335da",
            "id": "tos.edition.pali-canon.sn56.53.en-sujato-bilara.bilara-d6d54741b7f2",
            "version": 1
          }
        },
        "context-1": {
          "pointer": "/same_as_posture",
          "record": {
            "digest": "sha256:c1822c832bb8da422b928dab026f034d934dd93a76646a267a861443219335da",
            "id": "tos.edition.pali-canon.sn56.53.en-sujato-bilara.bilara-d6d54741b7f2",
            "version": 1
          }
        },
        "context-2": {
          "pointer": "/field_languages/preferred_label",
          "record": {
            "digest": "sha256:c1822c832bb8da422b928dab026f034d934dd93a76646a267a861443219335da",
            "id": "tos.edition.pali-canon.sn56.53.en-sujato-bilara.bilara-d6d54741b7f2",
            "version": 1
          }
        },
        "wording": {
          "pointer": "/preferred_label",
          "record": {
            "digest": "sha256:c1822c832bb8da422b928dab026f034d934dd93a76646a267a861443219335da",
            "id": "tos.edition.pali-canon.sn56.53.en-sujato-bilara.bilara-d6d54741b7f2",
            "version": 1
          }
        }
      },
      "content": {
        "kind": "source-copy",
        "slot": "wording"
      },
      "creator_id": "model:codex",
      "form_id": "tos.form.metadata.98000e83a0b92448a11017c2ef1de8fc3059787cd7e32fa2f16b3049dc733e6a",
      "form_version": 1,
      "language": "en",
      "revises": null,
      "role": "name",
      "schema_version": "tos_human_form_v1",
      "script": "Latn",
      "subject": {
        "digest": "sha256:c1822c832bb8da422b928dab026f034d934dd93a76646a267a861443219335da",
        "id": "tos.edition.pali-canon.sn56.53.en-sujato-bilara.bilara-d6d54741b7f2",
        "version": 1
      }
    },
    {
      "bindings": {
        "context-0": {
          "pointer": "/identity_status",
          "record": {
            "digest": "sha256:c1822c832bb8da422b928dab026f034d934dd93a76646a267a861443219335da",
            "id": "tos.edition.pali-canon.sn56.53.en-sujato-bilara.bilara-d6d54741b7f2",
            "version": 1
          }
        },
        "context-1": {
          "pointer": "/same_as_posture",
          "record": {
            "digest": "sha256:c1822c832bb8da422b928dab026f034d934dd93a76646a267a861443219335da",
            "id": "tos.edition.pali-canon.sn56.53.en-sujato-bilara.bilara-d6d54741b7f2",
            "version": 1
          }
        },
        "context-2": {
          "pointer": "/field_languages/notes",
          "record": {
            "digest": "sha256:c1822c832bb8da422b928dab026f034d934dd93a76646a267a861443219335da",
            "id": "tos.edition.pali-canon.sn56.53.en-sujato-bilara.bilara-d6d54741b7f2",
            "version": 1
          }
        },
        "wording": {
          "pointer": "/notes",
          "record": {
            "digest": "sha256:c1822c832bb8da422b928dab026f034d934dd93a76646a267a861443219335da",
            "id": "tos.edition.pali-canon.sn56.53.en-sujato-bilara.bilara-d6d54741b7f2",
            "version": 1
          }
        }
      },
      "content": {
        "kind": "source-copy",
        "slot": "wording"
      },
      "creator_id": "model:codex",
      "form_id": "tos.form.metadata.51bd472733816831ed660249d4b1556137e62c12e906628fa861a8bc46032ba0",
      "form_version": 1,
      "language": "en",
      "revises": null,
      "role": "hover",
      "schema_version": "tos_human_form_v1",
      "script": "Latn",
      "subject": {
        "digest": "sha256:c1822c832bb8da422b928dab026f034d934dd93a76646a267a861443219335da",
        "id": "tos.edition.pali-canon.sn56.53.en-sujato-bilara.bilara-d6d54741b7f2",
        "version": 1
      }
    }
  ],
  "prior_forms": [],
  "growth_history": [
    {
      "command_id": "registry-seventeenth-English-source-forms:dbe880bd48649cf8b5b232e1c88072dc978cf1be0d02a7b37b2a3cc8c6bd592f",
      "request_digest": "sha256:fd84e4297c82444960b178ad2be474058634c43b7757bcdd07d968ffba23bc8c",
      "principal_id": "model:codex",
      "authority_ref": "A18/source-witnesses",
      "owner_configuration": "sha256:0865964f1bb5b52e3fbb82d264a4acf70407aea4932c49c7cf60dbc9a8179dee",
      "recorded_at": "2026-09-12T18:19:31.020358+00:00",
      "source": {
        "id": "tos.edition.pali-canon.sn56.53.en-sujato-bilara.bilara-d6d54741b7f2",
        "version": 1,
        "digest": "sha256:c1822c832bb8da422b928dab026f034d934dd93a76646a267a861443219335da"
      },
      "previous_revision": null,
      "results": [
        {
          "id": "tos.form.metadata.98000e83a0b92448a11017c2ef1de8fc3059787cd7e32fa2f16b3049dc733e6a",
          "version": 1,
          "digest": "sha256:f9f30655fd68e02f5e9da94406a6b0ba076d329378000d52c3e173a924191169"
        },
        {
          "id": "tos.form.metadata.51bd472733816831ed660249d4b1556137e62c12e906628fa861a8bc46032ba0",
          "version": 1,
          "digest": "sha256:c766c25ca9ebfef65b6c0c22d8f263e043dea1f092e154038e7296005d45f09d"
        }
      ]
    }
  ]
}
