{
  "schema_version": "tos_human_form_set_v1",
  "subject": {
    "id": "tos.item.pali-canon.an4.124.en-sujato-bilara.bilara-d6d54741b7f2.git-segment-json",
    "version": 1,
    "digest": "sha256:e499e6588830afdd881f711037fd9b7d8c462623771f22b7f8485cf6e76f11ba"
  },
  "forms": [
    {
      "bindings": {
        "context-0": {
          "pointer": "/identity_status",
          "record": {
            "digest": "sha256:e499e6588830afdd881f711037fd9b7d8c462623771f22b7f8485cf6e76f11ba",
            "id": "tos.item.pali-canon.an4.124.en-sujato-bilara.bilara-d6d54741b7f2.git-segment-json",
            "version": 1
          }
        },
        "context-1": {
          "pointer": "/same_as_posture",
          "record": {
            "digest": "sha256:e499e6588830afdd881f711037fd9b7d8c462623771f22b7f8485cf6e76f11ba",
            "id": "tos.item.pali-canon.an4.124.en-sujato-bilara.bilara-d6d54741b7f2.git-segment-json",
            "version": 1
          }
        },
        "context-2": {
          "pointer": "/field_languages/preferred_label",
          "record": {
            "digest": "sha256:e499e6588830afdd881f711037fd9b7d8c462623771f22b7f8485cf6e76f11ba",
            "id": "tos.item.pali-canon.an4.124.en-sujato-bilara.bilara-d6d54741b7f2.git-segment-json",
            "version": 1
          }
        },
        "wording": {
          "pointer": "/preferred_label",
          "record": {
            "digest": "sha256:e499e6588830afdd881f711037fd9b7d8c462623771f22b7f8485cf6e76f11ba",
            "id": "tos.item.pali-canon.an4.124.en-sujato-bilara.bilara-d6d54741b7f2.git-segment-json",
            "version": 1
          }
        }
      },
      "content": {
        "kind": "source-copy",
        "slot": "wording"
      },
      "creator_id": "model:codex",
      "form_id": "tos.form.metadata.bddea9a9b0edf170c3ad20a53ec03e61285078efba213447261fcb21e3bab12c",
      "form_version": 1,
      "language": "en",
      "revises": null,
      "role": "name",
      "schema_version": "tos_human_form_v1",
      "script": "Latn",
      "subject": {
        "digest": "sha256:e499e6588830afdd881f711037fd9b7d8c462623771f22b7f8485cf6e76f11ba",
        "id": "tos.item.pali-canon.an4.124.en-sujato-bilara.bilara-d6d54741b7f2.git-segment-json",
        "version": 1
      }
    },
    {
      "bindings": {
        "context-0": {
          "pointer": "/identity_status",
          "record": {
            "digest": "sha256:e499e6588830afdd881f711037fd9b7d8c462623771f22b7f8485cf6e76f11ba",
            "id": "tos.item.pali-canon.an4.124.en-sujato-bilara.bilara-d6d54741b7f2.git-segment-json",
            "version": 1
          }
        },
        "context-1": {
          "pointer": "/same_as_posture",
          "record": {
            "digest": "sha256:e499e6588830afdd881f711037fd9b7d8c462623771f22b7f8485cf6e76f11ba",
            "id": "tos.item.pali-canon.an4.124.en-sujato-bilara.bilara-d6d54741b7f2.git-segment-json",
            "version": 1
          }
        },
        "context-2": {
          "pointer": "/field_languages/notes",
          "record": {
            "digest": "sha256:e499e6588830afdd881f711037fd9b7d8c462623771f22b7f8485cf6e76f11ba",
            "id": "tos.item.pali-canon.an4.124.en-sujato-bilara.bilara-d6d54741b7f2.git-segment-json",
            "version": 1
          }
        },
        "wording": {
          "pointer": "/notes",
          "record": {
            "digest": "sha256:e499e6588830afdd881f711037fd9b7d8c462623771f22b7f8485cf6e76f11ba",
            "id": "tos.item.pali-canon.an4.124.en-sujato-bilara.bilara-d6d54741b7f2.git-segment-json",
            "version": 1
          }
        }
      },
      "content": {
        "kind": "source-copy",
        "slot": "wording"
      },
      "creator_id": "model:codex",
      "form_id": "tos.form.metadata.4437853a36618cea942e7ab7b2eae6300c7d703c8b1448bb60470a56ad630f23",
      "form_version": 1,
      "language": "en",
      "revises": null,
      "role": "hover",
      "schema_version": "tos_human_form_v1",
      "script": "Latn",
      "subject": {
        "digest": "sha256:e499e6588830afdd881f711037fd9b7d8c462623771f22b7f8485cf6e76f11ba",
        "id": "tos.item.pali-canon.an4.124.en-sujato-bilara.bilara-d6d54741b7f2.git-segment-json",
        "version": 1
      }
    }
  ],
  "prior_forms": [],
  "growth_history": [
    {
      "command_id": "registry-seventeenth-English-source-forms:3676fbb7db48e607cdefaf91e4ba022de41aef62e3a6fb29b50f6508b60fe8e4",
      "request_digest": "sha256:5ac09084d9c3434acd9712dcbfe00098cecff64325eefea8e9c2884feecb2919",
      "principal_id": "model:codex",
      "authority_ref": "A18/source-witnesses",
      "owner_configuration": "sha256:ea8b6488416a0bd6a68d82b0b8a75c6704a099cf15edfeaf864c4630d6825558",
      "recorded_at": "2026-09-12T18:14:53.314875+00:00",
      "source": {
        "id": "tos.item.pali-canon.an4.124.en-sujato-bilara.bilara-d6d54741b7f2.git-segment-json",
        "version": 1,
        "digest": "sha256:e499e6588830afdd881f711037fd9b7d8c462623771f22b7f8485cf6e76f11ba"
      },
      "previous_revision": null,
      "results": [
        {
          "id": "tos.form.metadata.bddea9a9b0edf170c3ad20a53ec03e61285078efba213447261fcb21e3bab12c",
          "version": 1,
          "digest": "sha256:380592482a39fa829863c6a6e10ab8c34c75f3450a54b61f8da980a063b355b9"
        },
        {
          "id": "tos.form.metadata.4437853a36618cea942e7ab7b2eae6300c7d703c8b1448bb60470a56ad630f23",
          "version": 1,
          "digest": "sha256:446164c7ebf4045841713874b778916b9ebff5cb6629c1ef41e8cbddd3041b2c"
        }
      ]
    }
  ]
}
