{
  "schema_version": "tos_human_form_set_v1",
  "subject": {
    "id": "tos.item.pali-canon.sn1.23.pli-ms-bilara.bilara-d6d54741b7f2.git-segment-json",
    "version": 1,
    "digest": "sha256:ca2c2fa3b67d996d95b55c41ce9d858bdfbd64c817857c4c28bf3b31ef1f5f85"
  },
  "forms": [
    {
      "bindings": {
        "context-0": {
          "pointer": "/identity_status",
          "record": {
            "digest": "sha256:ca2c2fa3b67d996d95b55c41ce9d858bdfbd64c817857c4c28bf3b31ef1f5f85",
            "id": "tos.item.pali-canon.sn1.23.pli-ms-bilara.bilara-d6d54741b7f2.git-segment-json",
            "version": 1
          }
        },
        "context-1": {
          "pointer": "/same_as_posture",
          "record": {
            "digest": "sha256:ca2c2fa3b67d996d95b55c41ce9d858bdfbd64c817857c4c28bf3b31ef1f5f85",
            "id": "tos.item.pali-canon.sn1.23.pli-ms-bilara.bilara-d6d54741b7f2.git-segment-json",
            "version": 1
          }
        },
        "context-2": {
          "pointer": "/field_languages/preferred_label",
          "record": {
            "digest": "sha256:ca2c2fa3b67d996d95b55c41ce9d858bdfbd64c817857c4c28bf3b31ef1f5f85",
            "id": "tos.item.pali-canon.sn1.23.pli-ms-bilara.bilara-d6d54741b7f2.git-segment-json",
            "version": 1
          }
        },
        "wording": {
          "pointer": "/preferred_label",
          "record": {
            "digest": "sha256:ca2c2fa3b67d996d95b55c41ce9d858bdfbd64c817857c4c28bf3b31ef1f5f85",
            "id": "tos.item.pali-canon.sn1.23.pli-ms-bilara.bilara-d6d54741b7f2.git-segment-json",
            "version": 1
          }
        }
      },
      "content": {
        "kind": "source-copy",
        "slot": "wording"
      },
      "creator_id": "model:codex",
      "form_id": "tos.form.metadata.1675e35fe0b48f8ecb77aaff3e2451787777d7bd74fa52b3a68dd56a73f946d9",
      "form_version": 1,
      "language": "en",
      "revises": null,
      "role": "name",
      "schema_version": "tos_human_form_v1",
      "script": "Latn",
      "subject": {
        "digest": "sha256:ca2c2fa3b67d996d95b55c41ce9d858bdfbd64c817857c4c28bf3b31ef1f5f85",
        "id": "tos.item.pali-canon.sn1.23.pli-ms-bilara.bilara-d6d54741b7f2.git-segment-json",
        "version": 1
      }
    },
    {
      "bindings": {
        "context-0": {
          "pointer": "/identity_status",
          "record": {
            "digest": "sha256:ca2c2fa3b67d996d95b55c41ce9d858bdfbd64c817857c4c28bf3b31ef1f5f85",
            "id": "tos.item.pali-canon.sn1.23.pli-ms-bilara.bilara-d6d54741b7f2.git-segment-json",
            "version": 1
          }
        },
        "context-1": {
          "pointer": "/same_as_posture",
          "record": {
            "digest": "sha256:ca2c2fa3b67d996d95b55c41ce9d858bdfbd64c817857c4c28bf3b31ef1f5f85",
            "id": "tos.item.pali-canon.sn1.23.pli-ms-bilara.bilara-d6d54741b7f2.git-segment-json",
            "version": 1
          }
        },
        "context-2": {
          "pointer": "/field_languages/notes",
          "record": {
            "digest": "sha256:ca2c2fa3b67d996d95b55c41ce9d858bdfbd64c817857c4c28bf3b31ef1f5f85",
            "id": "tos.item.pali-canon.sn1.23.pli-ms-bilara.bilara-d6d54741b7f2.git-segment-json",
            "version": 1
          }
        },
        "wording": {
          "pointer": "/notes",
          "record": {
            "digest": "sha256:ca2c2fa3b67d996d95b55c41ce9d858bdfbd64c817857c4c28bf3b31ef1f5f85",
            "id": "tos.item.pali-canon.sn1.23.pli-ms-bilara.bilara-d6d54741b7f2.git-segment-json",
            "version": 1
          }
        }
      },
      "content": {
        "kind": "source-copy",
        "slot": "wording"
      },
      "creator_id": "model:codex",
      "form_id": "tos.form.metadata.390d8296f76c1d70b95bf1de090e0e86254a5a4736d6bf372ecea94e1bf9fbf5",
      "form_version": 1,
      "language": "en",
      "revises": null,
      "role": "hover",
      "schema_version": "tos_human_form_v1",
      "script": "Latn",
      "subject": {
        "digest": "sha256:ca2c2fa3b67d996d95b55c41ce9d858bdfbd64c817857c4c28bf3b31ef1f5f85",
        "id": "tos.item.pali-canon.sn1.23.pli-ms-bilara.bilara-d6d54741b7f2.git-segment-json",
        "version": 1
      }
    }
  ],
  "prior_forms": [],
  "growth_history": [
    {
      "command_id": "registry-fourteenth-pali-source-forms:38cc6cd681866be6b7954e13a957e9f6acfd9224dca039cad43c47f066632953",
      "request_digest": "sha256:a1303dc4f989580a50063549cfa4e06a35a6dd3e5ca3ab991926aed14ac42154",
      "principal_id": "model:codex",
      "authority_ref": "session:01a08281-293a-7ff0-927a-0fd73dfacf7d",
      "owner_configuration": "sha256:4074867ea4e96bcb3422f1b27c4df04bb7c8e923cf6ff94420814bbd949d6843",
      "recorded_at": "2026-09-09T23:20:21.040225+00:00",
      "source": {
        "id": "tos.item.pali-canon.sn1.23.pli-ms-bilara.bilara-d6d54741b7f2.git-segment-json",
        "version": 1,
        "digest": "sha256:ca2c2fa3b67d996d95b55c41ce9d858bdfbd64c817857c4c28bf3b31ef1f5f85"
      },
      "previous_revision": null,
      "results": [
        {
          "id": "tos.form.metadata.1675e35fe0b48f8ecb77aaff3e2451787777d7bd74fa52b3a68dd56a73f946d9",
          "version": 1,
          "digest": "sha256:07724555ce06307e297d59d672696aa6b3fcac8b6c1c82934ac9e70a160e7349"
        },
        {
          "id": "tos.form.metadata.390d8296f76c1d70b95bf1de090e0e86254a5a4736d6bf372ecea94e1bf9fbf5",
          "version": 1,
          "digest": "sha256:eff2e966849acddf54701dbaf305a9238c0a9ee1fbf322d5bb8d38469a1f0a41"
        }
      ]
    }
  ]
}
