{
  "schema_version": "tos_human_form_set_v1",
  "subject": {
    "id": "tos.item.pali-canon.sn1.74.pli-ms-bilara.bilara-d6d54741b7f2.git-segment-json",
    "version": 1,
    "digest": "sha256:b86d2196367c90eee8ff736c0008126977cb11ca7985bc8abdc3f9b3070ec050"
  },
  "forms": [
    {
      "bindings": {
        "context-0": {
          "pointer": "/identity_status",
          "record": {
            "digest": "sha256:b86d2196367c90eee8ff736c0008126977cb11ca7985bc8abdc3f9b3070ec050",
            "id": "tos.item.pali-canon.sn1.74.pli-ms-bilara.bilara-d6d54741b7f2.git-segment-json",
            "version": 1
          }
        },
        "context-1": {
          "pointer": "/same_as_posture",
          "record": {
            "digest": "sha256:b86d2196367c90eee8ff736c0008126977cb11ca7985bc8abdc3f9b3070ec050",
            "id": "tos.item.pali-canon.sn1.74.pli-ms-bilara.bilara-d6d54741b7f2.git-segment-json",
            "version": 1
          }
        },
        "context-2": {
          "pointer": "/field_languages/preferred_label",
          "record": {
            "digest": "sha256:b86d2196367c90eee8ff736c0008126977cb11ca7985bc8abdc3f9b3070ec050",
            "id": "tos.item.pali-canon.sn1.74.pli-ms-bilara.bilara-d6d54741b7f2.git-segment-json",
            "version": 1
          }
        },
        "wording": {
          "pointer": "/preferred_label",
          "record": {
            "digest": "sha256:b86d2196367c90eee8ff736c0008126977cb11ca7985bc8abdc3f9b3070ec050",
            "id": "tos.item.pali-canon.sn1.74.pli-ms-bilara.bilara-d6d54741b7f2.git-segment-json",
            "version": 1
          }
        }
      },
      "content": {
        "kind": "source-copy",
        "slot": "wording"
      },
      "creator_id": "model:codex",
      "form_id": "tos.form.metadata.c627ef674de6c57254dc9913d028c03f1da6bc7ef333afb24030161da17606a9",
      "form_version": 1,
      "language": "en",
      "revises": null,
      "role": "name",
      "schema_version": "tos_human_form_v1",
      "script": "Latn",
      "subject": {
        "digest": "sha256:b86d2196367c90eee8ff736c0008126977cb11ca7985bc8abdc3f9b3070ec050",
        "id": "tos.item.pali-canon.sn1.74.pli-ms-bilara.bilara-d6d54741b7f2.git-segment-json",
        "version": 1
      }
    },
    {
      "bindings": {
        "context-0": {
          "pointer": "/identity_status",
          "record": {
            "digest": "sha256:b86d2196367c90eee8ff736c0008126977cb11ca7985bc8abdc3f9b3070ec050",
            "id": "tos.item.pali-canon.sn1.74.pli-ms-bilara.bilara-d6d54741b7f2.git-segment-json",
            "version": 1
          }
        },
        "context-1": {
          "pointer": "/same_as_posture",
          "record": {
            "digest": "sha256:b86d2196367c90eee8ff736c0008126977cb11ca7985bc8abdc3f9b3070ec050",
            "id": "tos.item.pali-canon.sn1.74.pli-ms-bilara.bilara-d6d54741b7f2.git-segment-json",
            "version": 1
          }
        },
        "context-2": {
          "pointer": "/field_languages/notes",
          "record": {
            "digest": "sha256:b86d2196367c90eee8ff736c0008126977cb11ca7985bc8abdc3f9b3070ec050",
            "id": "tos.item.pali-canon.sn1.74.pli-ms-bilara.bilara-d6d54741b7f2.git-segment-json",
            "version": 1
          }
        },
        "wording": {
          "pointer": "/notes",
          "record": {
            "digest": "sha256:b86d2196367c90eee8ff736c0008126977cb11ca7985bc8abdc3f9b3070ec050",
            "id": "tos.item.pali-canon.sn1.74.pli-ms-bilara.bilara-d6d54741b7f2.git-segment-json",
            "version": 1
          }
        }
      },
      "content": {
        "kind": "source-copy",
        "slot": "wording"
      },
      "creator_id": "model:codex",
      "form_id": "tos.form.metadata.76f8f25dd66913b840ae8a30277f3a152e4287b60b8a24b4d072820ef98f55dd",
      "form_version": 1,
      "language": "en",
      "revises": null,
      "role": "hover",
      "schema_version": "tos_human_form_v1",
      "script": "Latn",
      "subject": {
        "digest": "sha256:b86d2196367c90eee8ff736c0008126977cb11ca7985bc8abdc3f9b3070ec050",
        "id": "tos.item.pali-canon.sn1.74.pli-ms-bilara.bilara-d6d54741b7f2.git-segment-json",
        "version": 1
      }
    }
  ],
  "prior_forms": [],
  "growth_history": [
    {
      "command_id": "registry-fourteenth-pali-source-forms:bb89626c8c630c717fca9d1ecf0c6620cfac0d757e29a6cda7fe443028c8ed6f",
      "request_digest": "sha256:3daa4cff1e4f9de50eb5558b0d9780f900fb4b28b1eccb181d65c0c6a49ef312",
      "principal_id": "model:codex",
      "authority_ref": "session:01a08281-293a-7ff0-927a-0fd73dfacf7d",
      "owner_configuration": "sha256:12b551a6fc60ce50738dc825ce7e689169a623e50fd53ed48e6eca9aaf059487",
      "recorded_at": "2026-09-09T23:20:25.997601+00:00",
      "source": {
        "id": "tos.item.pali-canon.sn1.74.pli-ms-bilara.bilara-d6d54741b7f2.git-segment-json",
        "version": 1,
        "digest": "sha256:b86d2196367c90eee8ff736c0008126977cb11ca7985bc8abdc3f9b3070ec050"
      },
      "previous_revision": null,
      "results": [
        {
          "id": "tos.form.metadata.c627ef674de6c57254dc9913d028c03f1da6bc7ef333afb24030161da17606a9",
          "version": 1,
          "digest": "sha256:b2216f5d7d5a072c7973518aee5f8419b767cf24d849b6ba7345e2226f9e0ce4"
        },
        {
          "id": "tos.form.metadata.76f8f25dd66913b840ae8a30277f3a152e4287b60b8a24b4d072820ef98f55dd",
          "version": 1,
          "digest": "sha256:f4a874f1bf97b193892a48dfee47046a89cbcc50db84d377c468666aa50df5a6"
        }
      ]
    }
  ]
}
