{
  "schema_version": "tos_human_form_set_v1",
  "subject": {
    "id": "tos.edition.pali-canon.sn12.18.pli-ms-bilara.bilara-d6d54741b7f2",
    "version": 1,
    "digest": "sha256:9666e02588b17269aa41af0f9f48c4f804754a908be5a1a6a76b82c93fcfa236"
  },
  "forms": [
    {
      "bindings": {
        "context-0": {
          "pointer": "/identity_status",
          "record": {
            "digest": "sha256:9666e02588b17269aa41af0f9f48c4f804754a908be5a1a6a76b82c93fcfa236",
            "id": "tos.edition.pali-canon.sn12.18.pli-ms-bilara.bilara-d6d54741b7f2",
            "version": 1
          }
        },
        "context-1": {
          "pointer": "/same_as_posture",
          "record": {
            "digest": "sha256:9666e02588b17269aa41af0f9f48c4f804754a908be5a1a6a76b82c93fcfa236",
            "id": "tos.edition.pali-canon.sn12.18.pli-ms-bilara.bilara-d6d54741b7f2",
            "version": 1
          }
        },
        "context-2": {
          "pointer": "/field_languages/preferred_label",
          "record": {
            "digest": "sha256:9666e02588b17269aa41af0f9f48c4f804754a908be5a1a6a76b82c93fcfa236",
            "id": "tos.edition.pali-canon.sn12.18.pli-ms-bilara.bilara-d6d54741b7f2",
            "version": 1
          }
        },
        "wording": {
          "pointer": "/preferred_label",
          "record": {
            "digest": "sha256:9666e02588b17269aa41af0f9f48c4f804754a908be5a1a6a76b82c93fcfa236",
            "id": "tos.edition.pali-canon.sn12.18.pli-ms-bilara.bilara-d6d54741b7f2",
            "version": 1
          }
        }
      },
      "content": {
        "kind": "source-copy",
        "slot": "wording"
      },
      "creator_id": "model:codex",
      "form_id": "tos.form.metadata.f76a615f00320146cb49257bb31ce7dfae7f07522b93ab00333f78bec2ce7d8c",
      "form_version": 1,
      "language": "en",
      "revises": null,
      "role": "name",
      "schema_version": "tos_human_form_v1",
      "script": "Latn",
      "subject": {
        "digest": "sha256:9666e02588b17269aa41af0f9f48c4f804754a908be5a1a6a76b82c93fcfa236",
        "id": "tos.edition.pali-canon.sn12.18.pli-ms-bilara.bilara-d6d54741b7f2",
        "version": 1
      }
    },
    {
      "bindings": {
        "context-0": {
          "pointer": "/identity_status",
          "record": {
            "digest": "sha256:9666e02588b17269aa41af0f9f48c4f804754a908be5a1a6a76b82c93fcfa236",
            "id": "tos.edition.pali-canon.sn12.18.pli-ms-bilara.bilara-d6d54741b7f2",
            "version": 1
          }
        },
        "context-1": {
          "pointer": "/same_as_posture",
          "record": {
            "digest": "sha256:9666e02588b17269aa41af0f9f48c4f804754a908be5a1a6a76b82c93fcfa236",
            "id": "tos.edition.pali-canon.sn12.18.pli-ms-bilara.bilara-d6d54741b7f2",
            "version": 1
          }
        },
        "context-2": {
          "pointer": "/field_languages/notes",
          "record": {
            "digest": "sha256:9666e02588b17269aa41af0f9f48c4f804754a908be5a1a6a76b82c93fcfa236",
            "id": "tos.edition.pali-canon.sn12.18.pli-ms-bilara.bilara-d6d54741b7f2",
            "version": 1
          }
        },
        "wording": {
          "pointer": "/notes",
          "record": {
            "digest": "sha256:9666e02588b17269aa41af0f9f48c4f804754a908be5a1a6a76b82c93fcfa236",
            "id": "tos.edition.pali-canon.sn12.18.pli-ms-bilara.bilara-d6d54741b7f2",
            "version": 1
          }
        }
      },
      "content": {
        "kind": "source-copy",
        "slot": "wording"
      },
      "creator_id": "model:codex",
      "form_id": "tos.form.metadata.87af12a87b18630559b7aae9e2c3fead843ca5276e598262a3c1f79be6fcd463",
      "form_version": 1,
      "language": "en",
      "revises": null,
      "role": "hover",
      "schema_version": "tos_human_form_v1",
      "script": "Latn",
      "subject": {
        "digest": "sha256:9666e02588b17269aa41af0f9f48c4f804754a908be5a1a6a76b82c93fcfa236",
        "id": "tos.edition.pali-canon.sn12.18.pli-ms-bilara.bilara-d6d54741b7f2",
        "version": 1
      }
    }
  ],
  "prior_forms": [],
  "growth_history": [
    {
      "command_id": "registry-fifteenth-pali-source-forms:4bcb4fcaa89a439b32725ef4c8e0a697a95092d158180bd87b12853902da7f2f",
      "request_digest": "sha256:5d4342962d7521bcf326b9d3fac200e1d1ddd9df1834d27dd5f63d4707382755",
      "principal_id": "model:codex",
      "authority_ref": "session:01a08281-293a-7ff0-927a-0fd73dfacf7d",
      "owner_configuration": "sha256:bd8ea213d481bd9bc7296f4a4dbded1739e611e84747b4f604aa06e7532a2dc9",
      "recorded_at": "2026-09-10T02:01:00.885174+00:00",
      "source": {
        "id": "tos.edition.pali-canon.sn12.18.pli-ms-bilara.bilara-d6d54741b7f2",
        "version": 1,
        "digest": "sha256:9666e02588b17269aa41af0f9f48c4f804754a908be5a1a6a76b82c93fcfa236"
      },
      "previous_revision": null,
      "results": [
        {
          "id": "tos.form.metadata.f76a615f00320146cb49257bb31ce7dfae7f07522b93ab00333f78bec2ce7d8c",
          "version": 1,
          "digest": "sha256:fc0d9e64ee71f3d2fb86467227ea975d414e8458211534b0cf31d03fe8477c16"
        },
        {
          "id": "tos.form.metadata.87af12a87b18630559b7aae9e2c3fead843ca5276e598262a3c1f79be6fcd463",
          "version": 1,
          "digest": "sha256:b67996921c86075fa183c58c29be47daadc499f79f9a80941c49dfe03c126744"
        }
      ]
    }
  ]
}
