{
  "schema_version": "tos_human_form_set_v1",
  "subject": {
    "id": "tos.item.pali-canon.sn48.17.en-sujato-bilara.bilara-d6d54741b7f2.git-segment-json",
    "version": 1,
    "digest": "sha256:06acfd3ffcb87d8f1b7b3f671c3c8a040a03d29f46832f3c7bdbdafc914ebfd6"
  },
  "forms": [
    {
      "bindings": {
        "context-0": {
          "pointer": "/identity_status",
          "record": {
            "digest": "sha256:06acfd3ffcb87d8f1b7b3f671c3c8a040a03d29f46832f3c7bdbdafc914ebfd6",
            "id": "tos.item.pali-canon.sn48.17.en-sujato-bilara.bilara-d6d54741b7f2.git-segment-json",
            "version": 1
          }
        },
        "context-1": {
          "pointer": "/same_as_posture",
          "record": {
            "digest": "sha256:06acfd3ffcb87d8f1b7b3f671c3c8a040a03d29f46832f3c7bdbdafc914ebfd6",
            "id": "tos.item.pali-canon.sn48.17.en-sujato-bilara.bilara-d6d54741b7f2.git-segment-json",
            "version": 1
          }
        },
        "context-2": {
          "pointer": "/field_languages/preferred_label",
          "record": {
            "digest": "sha256:06acfd3ffcb87d8f1b7b3f671c3c8a040a03d29f46832f3c7bdbdafc914ebfd6",
            "id": "tos.item.pali-canon.sn48.17.en-sujato-bilara.bilara-d6d54741b7f2.git-segment-json",
            "version": 1
          }
        },
        "wording": {
          "pointer": "/preferred_label",
          "record": {
            "digest": "sha256:06acfd3ffcb87d8f1b7b3f671c3c8a040a03d29f46832f3c7bdbdafc914ebfd6",
            "id": "tos.item.pali-canon.sn48.17.en-sujato-bilara.bilara-d6d54741b7f2.git-segment-json",
            "version": 1
          }
        }
      },
      "content": {
        "kind": "source-copy",
        "slot": "wording"
      },
      "creator_id": "model:codex",
      "form_id": "tos.form.metadata.02ab4bb9619cf9f015ae2ad18294b21673ed7f04554e375e665eecc94c1acd01",
      "form_version": 1,
      "language": "en",
      "revises": null,
      "role": "name",
      "schema_version": "tos_human_form_v1",
      "script": "Latn",
      "subject": {
        "digest": "sha256:06acfd3ffcb87d8f1b7b3f671c3c8a040a03d29f46832f3c7bdbdafc914ebfd6",
        "id": "tos.item.pali-canon.sn48.17.en-sujato-bilara.bilara-d6d54741b7f2.git-segment-json",
        "version": 1
      }
    },
    {
      "bindings": {
        "context-0": {
          "pointer": "/identity_status",
          "record": {
            "digest": "sha256:06acfd3ffcb87d8f1b7b3f671c3c8a040a03d29f46832f3c7bdbdafc914ebfd6",
            "id": "tos.item.pali-canon.sn48.17.en-sujato-bilara.bilara-d6d54741b7f2.git-segment-json",
            "version": 1
          }
        },
        "context-1": {
          "pointer": "/same_as_posture",
          "record": {
            "digest": "sha256:06acfd3ffcb87d8f1b7b3f671c3c8a040a03d29f46832f3c7bdbdafc914ebfd6",
            "id": "tos.item.pali-canon.sn48.17.en-sujato-bilara.bilara-d6d54741b7f2.git-segment-json",
            "version": 1
          }
        },
        "context-2": {
          "pointer": "/field_languages/notes",
          "record": {
            "digest": "sha256:06acfd3ffcb87d8f1b7b3f671c3c8a040a03d29f46832f3c7bdbdafc914ebfd6",
            "id": "tos.item.pali-canon.sn48.17.en-sujato-bilara.bilara-d6d54741b7f2.git-segment-json",
            "version": 1
          }
        },
        "wording": {
          "pointer": "/notes",
          "record": {
            "digest": "sha256:06acfd3ffcb87d8f1b7b3f671c3c8a040a03d29f46832f3c7bdbdafc914ebfd6",
            "id": "tos.item.pali-canon.sn48.17.en-sujato-bilara.bilara-d6d54741b7f2.git-segment-json",
            "version": 1
          }
        }
      },
      "content": {
        "kind": "source-copy",
        "slot": "wording"
      },
      "creator_id": "model:codex",
      "form_id": "tos.form.metadata.c63877d9faa5b0275b7161c1e92e26cbf02047f479ddc2a24d6848d6c22d0828",
      "form_version": 1,
      "language": "en",
      "revises": null,
      "role": "hover",
      "schema_version": "tos_human_form_v1",
      "script": "Latn",
      "subject": {
        "digest": "sha256:06acfd3ffcb87d8f1b7b3f671c3c8a040a03d29f46832f3c7bdbdafc914ebfd6",
        "id": "tos.item.pali-canon.sn48.17.en-sujato-bilara.bilara-d6d54741b7f2.git-segment-json",
        "version": 1
      }
    }
  ],
  "prior_forms": [],
  "growth_history": [
    {
      "command_id": "registry-seventeenth-English-source-forms:3a85e3ba023f34ae9078222aa95263db4637d61b01631d824e3ffe36981428d4",
      "request_digest": "sha256:69a4240accc39e1b630e2ac6c4d60c666ea615f2f9c475d7cc3daefaa24fa88d",
      "principal_id": "model:codex",
      "authority_ref": "A18/source-witnesses",
      "owner_configuration": "sha256:3d2fd2a75874bd1f54493a5a03d076610d3b4cbe6c0996d1ef7cac71a3ec2426",
      "recorded_at": "2026-09-12T18:19:01.704685+00:00",
      "source": {
        "id": "tos.item.pali-canon.sn48.17.en-sujato-bilara.bilara-d6d54741b7f2.git-segment-json",
        "version": 1,
        "digest": "sha256:06acfd3ffcb87d8f1b7b3f671c3c8a040a03d29f46832f3c7bdbdafc914ebfd6"
      },
      "previous_revision": null,
      "results": [
        {
          "id": "tos.form.metadata.02ab4bb9619cf9f015ae2ad18294b21673ed7f04554e375e665eecc94c1acd01",
          "version": 1,
          "digest": "sha256:8dda53ceb5bc13be7fa3f424ce7a256bb30bffd196dd5cbf9edffec0280f058b"
        },
        {
          "id": "tos.form.metadata.c63877d9faa5b0275b7161c1e92e26cbf02047f479ddc2a24d6848d6c22d0828",
          "version": 1,
          "digest": "sha256:1ab6b0110605c8183f15b9c47766b34098382ef92c21fba72e60d6faccfa2004"
        }
      ]
    }
  ]
}
