{
  "schema_version": "tos_human_form_set_v1",
  "subject": {
    "id": "tos.edition.pali-canon.sn22.13.pli-ms-bilara.bilara-d6d54741b7f2",
    "version": 1,
    "digest": "sha256:b59cf1daa86c0529ded6519a1a641f26d53b7ea6f1d5d4a5dfce7ad03d1a2c95"
  },
  "forms": [
    {
      "bindings": {
        "context-0": {
          "pointer": "/identity_status",
          "record": {
            "digest": "sha256:b59cf1daa86c0529ded6519a1a641f26d53b7ea6f1d5d4a5dfce7ad03d1a2c95",
            "id": "tos.edition.pali-canon.sn22.13.pli-ms-bilara.bilara-d6d54741b7f2",
            "version": 1
          }
        },
        "context-1": {
          "pointer": "/same_as_posture",
          "record": {
            "digest": "sha256:b59cf1daa86c0529ded6519a1a641f26d53b7ea6f1d5d4a5dfce7ad03d1a2c95",
            "id": "tos.edition.pali-canon.sn22.13.pli-ms-bilara.bilara-d6d54741b7f2",
            "version": 1
          }
        },
        "context-2": {
          "pointer": "/field_languages/preferred_label",
          "record": {
            "digest": "sha256:b59cf1daa86c0529ded6519a1a641f26d53b7ea6f1d5d4a5dfce7ad03d1a2c95",
            "id": "tos.edition.pali-canon.sn22.13.pli-ms-bilara.bilara-d6d54741b7f2",
            "version": 1
          }
        },
        "wording": {
          "pointer": "/preferred_label",
          "record": {
            "digest": "sha256:b59cf1daa86c0529ded6519a1a641f26d53b7ea6f1d5d4a5dfce7ad03d1a2c95",
            "id": "tos.edition.pali-canon.sn22.13.pli-ms-bilara.bilara-d6d54741b7f2",
            "version": 1
          }
        }
      },
      "content": {
        "kind": "source-copy",
        "slot": "wording"
      },
      "creator_id": "model:codex",
      "form_id": "tos.form.metadata.8e3062ac409ffd95144b35635aecf198004d0cb2850cbe166792062e6b2cd3a5",
      "form_version": 1,
      "language": "en",
      "revises": null,
      "role": "name",
      "schema_version": "tos_human_form_v1",
      "script": "Latn",
      "subject": {
        "digest": "sha256:b59cf1daa86c0529ded6519a1a641f26d53b7ea6f1d5d4a5dfce7ad03d1a2c95",
        "id": "tos.edition.pali-canon.sn22.13.pli-ms-bilara.bilara-d6d54741b7f2",
        "version": 1
      }
    },
    {
      "bindings": {
        "context-0": {
          "pointer": "/identity_status",
          "record": {
            "digest": "sha256:b59cf1daa86c0529ded6519a1a641f26d53b7ea6f1d5d4a5dfce7ad03d1a2c95",
            "id": "tos.edition.pali-canon.sn22.13.pli-ms-bilara.bilara-d6d54741b7f2",
            "version": 1
          }
        },
        "context-1": {
          "pointer": "/same_as_posture",
          "record": {
            "digest": "sha256:b59cf1daa86c0529ded6519a1a641f26d53b7ea6f1d5d4a5dfce7ad03d1a2c95",
            "id": "tos.edition.pali-canon.sn22.13.pli-ms-bilara.bilara-d6d54741b7f2",
            "version": 1
          }
        },
        "context-2": {
          "pointer": "/field_languages/notes",
          "record": {
            "digest": "sha256:b59cf1daa86c0529ded6519a1a641f26d53b7ea6f1d5d4a5dfce7ad03d1a2c95",
            "id": "tos.edition.pali-canon.sn22.13.pli-ms-bilara.bilara-d6d54741b7f2",
            "version": 1
          }
        },
        "wording": {
          "pointer": "/notes",
          "record": {
            "digest": "sha256:b59cf1daa86c0529ded6519a1a641f26d53b7ea6f1d5d4a5dfce7ad03d1a2c95",
            "id": "tos.edition.pali-canon.sn22.13.pli-ms-bilara.bilara-d6d54741b7f2",
            "version": 1
          }
        }
      },
      "content": {
        "kind": "source-copy",
        "slot": "wording"
      },
      "creator_id": "model:codex",
      "form_id": "tos.form.metadata.d939e672cabc22592c7dada40cb0a18207a9bbf91a21ffd9fde0f29ce8b8d882",
      "form_version": 1,
      "language": "en",
      "revises": null,
      "role": "hover",
      "schema_version": "tos_human_form_v1",
      "script": "Latn",
      "subject": {
        "digest": "sha256:b59cf1daa86c0529ded6519a1a641f26d53b7ea6f1d5d4a5dfce7ad03d1a2c95",
        "id": "tos.edition.pali-canon.sn22.13.pli-ms-bilara.bilara-d6d54741b7f2",
        "version": 1
      }
    }
  ],
  "prior_forms": [],
  "growth_history": [
    {
      "command_id": "registry-fifteenth-pali-source-forms:4b60a0b12c6d0b6bafa1e4bd82398fdf87610febac9f19d5163717a64d867096",
      "request_digest": "sha256:619fb14379fcfd14dc484db37793582d902b1b9dd67f133bcb2bb47af5b62d57",
      "principal_id": "model:codex",
      "authority_ref": "session:01a08281-293a-7ff0-927a-0fd73dfacf7d",
      "owner_configuration": "sha256:20dce1c18bec878b82c8747f77750d4f7d5c14c18b1681fd114bc8b0a4e81769",
      "recorded_at": "2026-09-10T02:01:28.153068+00:00",
      "source": {
        "id": "tos.edition.pali-canon.sn22.13.pli-ms-bilara.bilara-d6d54741b7f2",
        "version": 1,
        "digest": "sha256:b59cf1daa86c0529ded6519a1a641f26d53b7ea6f1d5d4a5dfce7ad03d1a2c95"
      },
      "previous_revision": null,
      "results": [
        {
          "id": "tos.form.metadata.8e3062ac409ffd95144b35635aecf198004d0cb2850cbe166792062e6b2cd3a5",
          "version": 1,
          "digest": "sha256:8b520a643e7eaf41b5b8a7e9989ab1fbc3de1c54901992ed0c08df1a1724c41c"
        },
        {
          "id": "tos.form.metadata.d939e672cabc22592c7dada40cb0a18207a9bbf91a21ffd9fde0f29ce8b8d882",
          "version": 1,
          "digest": "sha256:77fb7b8c01e672e243e886043534266666216d2ced174baae7cd481392f8113a"
        }
      ]
    }
  ]
}
