{
  "schema_version": "tos_human_form_set_v1",
  "subject": {
    "id": "tos.item.pali-canon.sn56.83.pli-ms-bilara.bilara-d6d54741b7f2.git-segment-json",
    "version": 1,
    "digest": "sha256:d23742561d1ddcb31930d6acc25859cadbf76b6f22855259ebddd4a73cb6df87"
  },
  "forms": [
    {
      "bindings": {
        "context-0": {
          "pointer": "/identity_status",
          "record": {
            "digest": "sha256:d23742561d1ddcb31930d6acc25859cadbf76b6f22855259ebddd4a73cb6df87",
            "id": "tos.item.pali-canon.sn56.83.pli-ms-bilara.bilara-d6d54741b7f2.git-segment-json",
            "version": 1
          }
        },
        "context-1": {
          "pointer": "/same_as_posture",
          "record": {
            "digest": "sha256:d23742561d1ddcb31930d6acc25859cadbf76b6f22855259ebddd4a73cb6df87",
            "id": "tos.item.pali-canon.sn56.83.pli-ms-bilara.bilara-d6d54741b7f2.git-segment-json",
            "version": 1
          }
        },
        "context-2": {
          "pointer": "/field_languages/preferred_label",
          "record": {
            "digest": "sha256:d23742561d1ddcb31930d6acc25859cadbf76b6f22855259ebddd4a73cb6df87",
            "id": "tos.item.pali-canon.sn56.83.pli-ms-bilara.bilara-d6d54741b7f2.git-segment-json",
            "version": 1
          }
        },
        "wording": {
          "pointer": "/preferred_label",
          "record": {
            "digest": "sha256:d23742561d1ddcb31930d6acc25859cadbf76b6f22855259ebddd4a73cb6df87",
            "id": "tos.item.pali-canon.sn56.83.pli-ms-bilara.bilara-d6d54741b7f2.git-segment-json",
            "version": 1
          }
        }
      },
      "content": {
        "kind": "source-copy",
        "slot": "wording"
      },
      "creator_id": "model:codex",
      "form_id": "tos.form.metadata.a4b1db29fc6a0b9d0761f34f1712ab9c83f39b20583775db5b07531af9acda77",
      "form_version": 1,
      "language": "en",
      "revises": null,
      "role": "name",
      "schema_version": "tos_human_form_v1",
      "script": "Latn",
      "subject": {
        "digest": "sha256:d23742561d1ddcb31930d6acc25859cadbf76b6f22855259ebddd4a73cb6df87",
        "id": "tos.item.pali-canon.sn56.83.pli-ms-bilara.bilara-d6d54741b7f2.git-segment-json",
        "version": 1
      }
    },
    {
      "bindings": {
        "context-0": {
          "pointer": "/identity_status",
          "record": {
            "digest": "sha256:d23742561d1ddcb31930d6acc25859cadbf76b6f22855259ebddd4a73cb6df87",
            "id": "tos.item.pali-canon.sn56.83.pli-ms-bilara.bilara-d6d54741b7f2.git-segment-json",
            "version": 1
          }
        },
        "context-1": {
          "pointer": "/same_as_posture",
          "record": {
            "digest": "sha256:d23742561d1ddcb31930d6acc25859cadbf76b6f22855259ebddd4a73cb6df87",
            "id": "tos.item.pali-canon.sn56.83.pli-ms-bilara.bilara-d6d54741b7f2.git-segment-json",
            "version": 1
          }
        },
        "context-2": {
          "pointer": "/field_languages/notes",
          "record": {
            "digest": "sha256:d23742561d1ddcb31930d6acc25859cadbf76b6f22855259ebddd4a73cb6df87",
            "id": "tos.item.pali-canon.sn56.83.pli-ms-bilara.bilara-d6d54741b7f2.git-segment-json",
            "version": 1
          }
        },
        "wording": {
          "pointer": "/notes",
          "record": {
            "digest": "sha256:d23742561d1ddcb31930d6acc25859cadbf76b6f22855259ebddd4a73cb6df87",
            "id": "tos.item.pali-canon.sn56.83.pli-ms-bilara.bilara-d6d54741b7f2.git-segment-json",
            "version": 1
          }
        }
      },
      "content": {
        "kind": "source-copy",
        "slot": "wording"
      },
      "creator_id": "model:codex",
      "form_id": "tos.form.metadata.1b89fef3497e5d3960b3925b41efe8b4a92b7e6b82e13dd3c96b97d1cc796c42",
      "form_version": 1,
      "language": "en",
      "revises": null,
      "role": "hover",
      "schema_version": "tos_human_form_v1",
      "script": "Latn",
      "subject": {
        "digest": "sha256:d23742561d1ddcb31930d6acc25859cadbf76b6f22855259ebddd4a73cb6df87",
        "id": "tos.item.pali-canon.sn56.83.pli-ms-bilara.bilara-d6d54741b7f2.git-segment-json",
        "version": 1
      }
    }
  ],
  "prior_forms": [],
  "growth_history": [
    {
      "command_id": "registry-seventeenth-pali-source-forms:4b4864b03b0f96bfbab0468fbdccfbdbc828a6d3abba7c823bc7b4ec441a86f6",
      "request_digest": "sha256:955b14708ef957da1598bd2e87e6d52b3ade733c13e31f463f264ac4974ffdb0",
      "principal_id": "model:codex",
      "authority_ref": "operator:tos-foundation-v1-20260905:registry-seventeenth-planting-20260912:pali",
      "owner_configuration": "sha256:c4b8399196452424b44a85e1c936336c6252ba5472389c53f3f81d022c2697c8",
      "recorded_at": "2026-09-12T15:13:03.843445+00:00",
      "source": {
        "id": "tos.item.pali-canon.sn56.83.pli-ms-bilara.bilara-d6d54741b7f2.git-segment-json",
        "version": 1,
        "digest": "sha256:d23742561d1ddcb31930d6acc25859cadbf76b6f22855259ebddd4a73cb6df87"
      },
      "previous_revision": null,
      "results": [
        {
          "id": "tos.form.metadata.a4b1db29fc6a0b9d0761f34f1712ab9c83f39b20583775db5b07531af9acda77",
          "version": 1,
          "digest": "sha256:98ab9b4458b2da9df7cd5928d24ac035bbacc8fcfbd825ee01ed4b46dc01dc79"
        },
        {
          "id": "tos.form.metadata.1b89fef3497e5d3960b3925b41efe8b4a92b7e6b82e13dd3c96b97d1cc796c42",
          "version": 1,
          "digest": "sha256:b65741df4ace55ab23497a694337e18ad49df5ead5a54b2cb707b28bcc866fd5"
        }
      ]
    }
  ]
}
