{
  "schema_version": "tos_human_form_set_v1",
  "subject": {
    "id": "tos.item.pali-canon.an3.90.en-sujato-bilara.bilara-d6d54741b7f2.git-segment-json",
    "version": 1,
    "digest": "sha256:54fe379c15beeea2e1b9db780d2556aa9a327b7d2edfd725e349ae0872b0ce6b"
  },
  "forms": [
    {
      "bindings": {
        "context-0": {
          "pointer": "/identity_status",
          "record": {
            "digest": "sha256:54fe379c15beeea2e1b9db780d2556aa9a327b7d2edfd725e349ae0872b0ce6b",
            "id": "tos.item.pali-canon.an3.90.en-sujato-bilara.bilara-d6d54741b7f2.git-segment-json",
            "version": 1
          }
        },
        "context-1": {
          "pointer": "/same_as_posture",
          "record": {
            "digest": "sha256:54fe379c15beeea2e1b9db780d2556aa9a327b7d2edfd725e349ae0872b0ce6b",
            "id": "tos.item.pali-canon.an3.90.en-sujato-bilara.bilara-d6d54741b7f2.git-segment-json",
            "version": 1
          }
        },
        "context-2": {
          "pointer": "/field_languages/preferred_label",
          "record": {
            "digest": "sha256:54fe379c15beeea2e1b9db780d2556aa9a327b7d2edfd725e349ae0872b0ce6b",
            "id": "tos.item.pali-canon.an3.90.en-sujato-bilara.bilara-d6d54741b7f2.git-segment-json",
            "version": 1
          }
        },
        "wording": {
          "pointer": "/preferred_label",
          "record": {
            "digest": "sha256:54fe379c15beeea2e1b9db780d2556aa9a327b7d2edfd725e349ae0872b0ce6b",
            "id": "tos.item.pali-canon.an3.90.en-sujato-bilara.bilara-d6d54741b7f2.git-segment-json",
            "version": 1
          }
        }
      },
      "content": {
        "kind": "source-copy",
        "slot": "wording"
      },
      "creator_id": "model:codex",
      "form_id": "tos.form.metadata.ff461ef29e37cf2e72c5f55c322a05c469c4925149e05a521777ee8ea901747d",
      "form_version": 1,
      "language": "en",
      "revises": null,
      "role": "name",
      "schema_version": "tos_human_form_v1",
      "script": "Latn",
      "subject": {
        "digest": "sha256:54fe379c15beeea2e1b9db780d2556aa9a327b7d2edfd725e349ae0872b0ce6b",
        "id": "tos.item.pali-canon.an3.90.en-sujato-bilara.bilara-d6d54741b7f2.git-segment-json",
        "version": 1
      }
    },
    {
      "bindings": {
        "context-0": {
          "pointer": "/identity_status",
          "record": {
            "digest": "sha256:54fe379c15beeea2e1b9db780d2556aa9a327b7d2edfd725e349ae0872b0ce6b",
            "id": "tos.item.pali-canon.an3.90.en-sujato-bilara.bilara-d6d54741b7f2.git-segment-json",
            "version": 1
          }
        },
        "context-1": {
          "pointer": "/same_as_posture",
          "record": {
            "digest": "sha256:54fe379c15beeea2e1b9db780d2556aa9a327b7d2edfd725e349ae0872b0ce6b",
            "id": "tos.item.pali-canon.an3.90.en-sujato-bilara.bilara-d6d54741b7f2.git-segment-json",
            "version": 1
          }
        },
        "context-2": {
          "pointer": "/field_languages/notes",
          "record": {
            "digest": "sha256:54fe379c15beeea2e1b9db780d2556aa9a327b7d2edfd725e349ae0872b0ce6b",
            "id": "tos.item.pali-canon.an3.90.en-sujato-bilara.bilara-d6d54741b7f2.git-segment-json",
            "version": 1
          }
        },
        "wording": {
          "pointer": "/notes",
          "record": {
            "digest": "sha256:54fe379c15beeea2e1b9db780d2556aa9a327b7d2edfd725e349ae0872b0ce6b",
            "id": "tos.item.pali-canon.an3.90.en-sujato-bilara.bilara-d6d54741b7f2.git-segment-json",
            "version": 1
          }
        }
      },
      "content": {
        "kind": "source-copy",
        "slot": "wording"
      },
      "creator_id": "model:codex",
      "form_id": "tos.form.metadata.7371630f8688ab8499ab7db26abeb6f60115bf1a685f40c7f072f65c98825e05",
      "form_version": 1,
      "language": "en",
      "revises": null,
      "role": "hover",
      "schema_version": "tos_human_form_v1",
      "script": "Latn",
      "subject": {
        "digest": "sha256:54fe379c15beeea2e1b9db780d2556aa9a327b7d2edfd725e349ae0872b0ce6b",
        "id": "tos.item.pali-canon.an3.90.en-sujato-bilara.bilara-d6d54741b7f2.git-segment-json",
        "version": 1
      }
    }
  ],
  "prior_forms": [],
  "growth_history": [
    {
      "command_id": "registry-seventeenth-English-source-forms:a150deebe789c837ba831f1eb7511412269118194b26847ecb0afa3e579ac9fb",
      "request_digest": "sha256:e86c08ffba109bec6c717582e25150f3ea407972ffa8b34808cd521c9b5fa287",
      "principal_id": "model:codex",
      "authority_ref": "A18/source-witnesses",
      "owner_configuration": "sha256:1e3d61b1d80bbe58316c0c185659aa131622eb66efb57e2c9706fe668da7aa18",
      "recorded_at": "2026-09-12T18:14:44.402127+00:00",
      "source": {
        "id": "tos.item.pali-canon.an3.90.en-sujato-bilara.bilara-d6d54741b7f2.git-segment-json",
        "version": 1,
        "digest": "sha256:54fe379c15beeea2e1b9db780d2556aa9a327b7d2edfd725e349ae0872b0ce6b"
      },
      "previous_revision": null,
      "results": [
        {
          "id": "tos.form.metadata.ff461ef29e37cf2e72c5f55c322a05c469c4925149e05a521777ee8ea901747d",
          "version": 1,
          "digest": "sha256:bef715d483fe5427f82be055a50aea52b6636213454d5a6f9b6ef44420185752"
        },
        {
          "id": "tos.form.metadata.7371630f8688ab8499ab7db26abeb6f60115bf1a685f40c7f072f65c98825e05",
          "version": 1,
          "digest": "sha256:d082204c120821d248899eb8f0136da2fe3b2982e301b257a5dd591d527e82bb"
        }
      ]
    }
  ]
}
